{
  "$schema": "https://json-schema.org/draft/2020-12/schema",
  "$id": "https://memstead.com/schemas/memstead-plugin/v1/binding",
  "title": "memstead-plugin/v1 binding",
  "description": "A Binding is ONE versioned record per pipeline at `.memstead/projections/<mem>/<name>.json`: the whole declaration (`intent`, inline `sources`, `reference_mems`, `destination_mem`, `deny_paths`, `coverage_semantics`, `rules`) plus an `operations { build, sync, verify }` block. The 2026-07 consolidation folded the retired standalone medium and facet records into the binding's `sources[]` — each source carries the medium half (where it lives: `type` / `pointer` / `change_detection`) and the facet half (which part of it: `scope` / `engagement` / `preparation`) under a `name` that keys per-source sync/verify state. `reference_mems` supply read-only cross-mem context; `destination_mem` is the mem the binding writes into. Every operation is optional: an absent build/sync makes that mutating operation refuse at run time with a `projection enable <op>` remedy; an absent verify means engine defaults. Verify mutates no entity, but it is not a pure read: a completed run records its findings store, backfills observed hashes onto hash-less anchors, and records a `#verified` baseline. The `prune` block, when present, enables deletion proposals in the sync brief.",
  "type": "object",
  "required": [
    "version",
    "destination_mem",
    "operations"
  ],
  "properties": {
    "version": {
      "description": "Binding format version. v2 bindings carry the integer 2; a file without it (or with a prior version) is quarantined by the loader as a retired format and is re-authored with `memstead projection init`.",
      "type": "integer",
      "const": 2
    },
    "intent": {
      "description": "What the binding is trying to accomplish — prose for the agent. Optional. An all-caps token of three or more characters is read as a relationship of the destination mem's schema: one the schema does not declare is a `BINDING_INTENT_UNKNOWN_RELATIONSHIP` finding on every brief and on the verify report, and `projection init` / `projection edit` refuse to write such an intent. File names (`CLAUDE.md`) and protocol or format acronyms (`HTTP`, `JSON`) read as prose.",
      "type": "string",
      "minLength": 1
    },
    "sources": {
      "description": "The inline sources the binding consumes, in declaration order. Each `name` is unique within the record.",
      "type": "array",
      "items": {
        "$ref": "#/$defs/source"
      }
    },
    "reference_mems": {
      "description": "Read-only reference mems (by name) that supply cross-mem context.",
      "type": "array",
      "items": {
        "type": "string",
        "minLength": 1
      }
    },
    "destination_mem": {
      "description": "The mem this binding writes into.",
      "type": "string",
      "minLength": 1
    },
    "deny_paths": {
      "description": "Paths excluded from the binding's scope (workspace-relative globs). Strategy-invariant — moved up from the per-ingest record. A glob deny list is legal only over a path-shaped medium namespace (codebase / filesystem / git); the engine refuses it at binding-validation time over a graph or web medium.",
      "type": "array",
      "items": {
        "type": "string"
      }
    },
    "coverage_semantics": {
      "description": "Whether the binding claims to cover everything in its declared scope (`exhaustive`) or a deliberately partial slice (`curated`). Optional: absent means NOT STATED — the effective value is resolved per medium (all sources on enumerable media → exhaustive; at least one non-enumerable source, e.g. web → curated). A declared `exhaustive` over a non-enumerable source is refused at binding validation with `curated` as the remedy.",
      "type": "string",
      "enum": [
        "exhaustive",
        "curated"
      ]
    },
    "rules": {
      "description": "Free-form binding rules (e.g. a one-shot lens `routing` string). Opaque to the engine — consumed only by the one-shot brief renderer.",
      "type": "object"
    },
    "prune": {
      "description": "Prune policy — additive, optional. Absent means prune is disabled (no deletion proposals). Present (an empty object) means prune produces deletion proposals in the sync brief: the source no longer holds the artifacts an entity describes, both sides are shown, and the agent acting on the brief decides. Prune has no independent schedule (it rides the sync brief, so it carries no trigger/batch_size) and no guarantee level: a source artifact and the entity about it share no merge base, so there is nothing for the engine to decide on the entity's behalf. The retired `guarantee` key of earlier records is ignored on read.",
      "type": "object",
      "properties": {},
      "additionalProperties": false
    },
    "operations": {
      "description": "The operations this binding declares. Every operation is optional; an absent mutating operation (build/sync) refuses at run time with a remedy, an absent verify means engine defaults.",
      "type": "object",
      "properties": {
        "build": {
          "$ref": "#/$defs/buildOperation"
        },
        "sync": {
          "$ref": "#/$defs/syncOperation"
        },
        "verify": {
          "$ref": "#/$defs/verifyOperation"
        }
      },
      "additionalProperties": false
    }
  },
  "additionalProperties": false,
  "$defs": {
    "buildOperation": {
      "description": "The build operation — the only operation carrying a mode. Grows new coverage (`discovery`) or runs a single bounded pass (`one-shot`). trigger / batch_size / post_actions are scheduling attributes.",
      "type": "object",
      "required": [
        "mode",
        "trigger",
        "batch_size"
      ],
      "properties": {
        "mode": {
          "description": "`discovery` builds out new coverage; `one-shot` runs a single bounded pass. The retired `refinement` value is not accepted.",
          "type": "string",
          "enum": [
            "discovery",
            "one-shot"
          ]
        },
        "trigger": {
          "$ref": "#/$defs/trigger"
        },
        "batch_size": {
          "$ref": "#/$defs/batchSize"
        },
        "post_actions": {
          "description": "Free-form post-run actions (e.g. a one-shot `archive_source` flag). Opaque to the engine — consumed only by the one-shot brief renderer.",
          "type": "object",
          "properties": {
            "archive_source": {
              "description": "When true, the one-shot brief instructs the agent to archive the source mem after every destination is processed.",
              "type": "boolean"
            }
          },
          "additionalProperties": false
        }
      },
      "additionalProperties": false
    },
    "syncOperation": {
      "description": "The sync operation — the sole maintenance writer. Carries no mode. An absent sync block makes that mutating operation refuse at run time.",
      "type": "object",
      "required": [
        "trigger",
        "batch_size"
      ],
      "properties": {
        "trigger": {
          "$ref": "#/$defs/trigger"
        },
        "batch_size": {
          "$ref": "#/$defs/batchSize"
        }
      },
      "additionalProperties": false
    },
    "verifyOperation": {
      "description": "The verify operation — measurement. Mutates no entity: it records findings into the verify surface's own store and backfills observed anchor hashes (measurement machinery). The `#verified` freshness baseline, its one write into the mem's config, moves only under `projection verify --advance`. Carries no mode. adjudication_cap and full_resync_every are additive tier-3 scheduling knobs that default to the engine's built-in values when absent.",
      "type": "object",
      "required": [
        "trigger",
        "batch_size"
      ],
      "properties": {
        "trigger": {
          "$ref": "#/$defs/trigger"
        },
        "batch_size": {
          "$ref": "#/$defs/batchSize"
        },
        "adjudication_cap": {
          "description": "The maximum number of hash-drift adjudications a single verify run asserts before queueing the remainder as backlog. 0 disables the cap.",
          "type": "integer",
          "minimum": 0
        },
        "full_resync_every": {
          "description": "Every N verify runs, a full-enumeration coverage sweep runs (for enumerable mediums). 0 disables scheduled full walks.",
          "type": "integer",
          "minimum": 0
        }
      },
      "additionalProperties": false
    },
    "trigger": {
      "description": "What sets an operation running. `loop` runs continuously under `/loop`; `manual` runs only when invoked; `on-event` is reserved for event-driven hooks.",
      "type": "string",
      "enum": [
        "loop",
        "manual",
        "on-event"
      ]
    },
    "batchSize": {
      "description": "How many artifacts a single run processes.",
      "type": "integer",
      "minimum": 1
    },
    "source": {
      "description": "One inline source — the full description of a body of information the pipeline reads: the medium half (`type` / `pointer` / `change_detection`) and the facet half (`scope` / `engagement` / `preparation`).",
      "type": "object",
      "required": [
        "name",
        "type",
        "pointer"
      ],
      "properties": {
        "name": {
          "description": "Stable name — keys per-source sync/verify state (`<mem>/<binding>/<source>#synced`).",
          "type": "string",
          "minLength": 1
        },
        "type": {
          "description": "What kind of surface this source references.",
          "type": "string",
          "enum": [
            "codebase",
            "filesystem",
            "graph",
            "git",
            "web"
          ]
        },
        "pointer": {
          "description": "Where the body of information lives — a path, URL, or mem id, interpreted per `type`.",
          "type": "string"
        },
        "change_detection": {
          "description": "Optional declared change-detection strategy: `none` / `git` / `mtime` / `auto`. Unset means `auto` (the engine probes for a git work tree). A graph-typed source always uses the graph snapshot signal.",
          "type": "string",
          "enum": [
            "none",
            "git",
            "mtime",
            "auto"
          ]
        },
        "scope": {
          "description": "Allow/deny selection over the source. Patterns are SOURCE-relative: each resolves against this source's `pointer`, so a scope is written as the paths beneath the pointer, exactly as the rendered brief presents them (`deny_paths` at the binding level are workspace-relative instead \u2014 they span every source, so they have no single pointer). A source with no allow patterns is unscoped \u2014 a typed refusal at run time, not \"everything\"; a source that truly wants everything writes `**/*`. A pattern that will not compile as a glob is refused at binding validation, naming it.",
          "type": "array",
          "items": {
            "$ref": "#/$defs/patternEntry"
          }
        },
        "engagement": {
          "description": "Engagement contract — verbs, tools, terminology, discipline. Free-form; the engine does not interpret it.",
          "type": "object"
        },
        "preparation": {
          "description": "Optional preparation identifier: one registered in the engine's preparation registry (today `entity-load-bearing` for graph sources, where an entity anchor's prepared form is the type's load-bearing sections, `dated-entries` for path-shaped sources, where a file of dated entries is delivered as units `<path>#<stamp>` in stamp order, and `code-map` for code sources, where a file anchor hashes the file's interface digest and a tree anchor the code map of the scoped files under it). At most one per source. An identifier the registry does not know is refused at validation time; a registered one over a medium whose anchor namespace admits none of its grains is refused too.",
          "type": "string",
          "minLength": 1
        }
      },
      "additionalProperties": false
    },
    "patternEntry": {
      "description": "One allow/deny glob in a source's selection.",
      "type": "object",
      "required": [
        "path",
        "mode"
      ],
      "properties": {
        "path": {
          "description": "Glob pattern, interpreted relative to the source's pointer.",
          "type": "string"
        },
        "mode": {
          "description": "Whether the pattern admits or excludes.",
          "type": "string",
          "enum": [
            "allow",
            "deny"
          ]
        }
      },
      "additionalProperties": false
    }
  }
}
