{
  "version": 2,
  "intent": "Keep the reference mem true to the source tree",
  "sources": [
    {
      "name": "guide",
      "type": "codebase",
      "pointer": "../src",
      "scope": [
        {
          "path": "**/*",
          "mode": "allow"
        }
      ]
    }
  ],
  "reference_mems": [],
  "destination_mem": "docs",
  "deny_paths": [
    "**/.DS_Store",
    "**/.git/**",
    "**/node_modules/**",
    "**/Thumbs.db"
  ],
  "prune": {},
  "operations": {
    "build": {
      "mode": "discovery",
      "trigger": "loop",
      "batch_size": 20
    },
    "sync": {
      "trigger": "manual",
      "batch_size": 20
    },
    "verify": {
      "trigger": "manual",
      "batch_size": 20,
      "adjudication_cap": 50,
      "full_resync_every": 20
    }
  }
}
