{"version":2,"intent":"model the fixture source tree","sources":[{"name":"source-tree","type":"codebase","pointer":"src","change_detection":"git","scope":[{"path":"src/**/*.md","mode":"allow"}]}],"reference_mems":[],"destination_mem":"docs","deny_paths":[],"coverage_semantics":"exhaustive","operations":{"build":{"mode":"discovery","trigger":"loop","batch_size":20},"sync":{"trigger":"manual","batch_size":20},"verify":{"trigger":"manual","batch_size":20,"adjudication_cap":50,"full_resync_every":20}}}
